{
  "$schema": "https://json-schema.org/draft/2020-12/schema",
  "$id": "local-reality-body.embodiment-state.v0.1",
  "type": "object",
  "required": [
    "schema",
    "body_id",
    "represented_currentness_revision",
    "mechanisms",
    "surfaces"
  ],
  "properties": {
    "schema": {
      "const": "local-reality-body.embodiment-state.v0.1"
    },
    "body_id": {
      "const": "RM-LOCAL-REALITY-BODY-001"
    },
    "represented_currentness_revision": {
      "const": 7
    },
    "mechanisms": {
      "type": "array",
      "minItems": 2
    },
    "surfaces": {
      "type": "array",
      "minItems": 1
    },
    "$schema": {
      "type": "string"
    }
  },
  "additionalProperties": true
}
