{
  "$schema": "../../CARRIER/SCHEMAS/embodiment-state.schema.json",
  "schema": "local-reality-body.embodiment-state.v0.1",
  "body_id": "RM-LOCAL-REALITY-BODY-001",
  "represented_currentness_revision": 7,
  "mechanisms": [
    {
      "mechanism_id": "RM-BODY-INTEGRITY-HOST-001",
      "historical_constitutional_classification": "REPLACEABLE_NON_CONSTITUTIVE_INTEGRITY_AND_ANSWERABILITY_ORGAN",
      "carrier_classification": "REPLACEABLE_EMBODIMENT_MECHANISM",
      "status": "ADMITTED_INACTIVE",
      "admission_occurrence_id": "RM-BODY-INTEGRITY-HOST-ADMISSION-OCCURRENCE-001",
      "implementation": {
        "carrier": "BODY/EMBODIMENT/MECHANISMS/BODY_INTEGRITY_HOST/V0_1/body_integrity_host.py",
        "sha256": "4f0ae922a9bd8a593b9be05b1e9b37fee1c41092f4c893781ea37096c97f7490"
      },
      "pressure_verifier": {
        "carrier": "BODY/EMBODIMENT/MECHANISMS/BODY_INTEGRITY_HOST/V0_1/verify_body_integrity_host.py",
        "sha256": "902bae93d0fa2711f4cf626003f5c0dbdff7539ac12644b64d1046e23dd17d64",
        "last_admission_result": "PASS_22_OF_22"
      },
      "activation_authorized": false,
      "real_body_act_processing_authorized": false,
      "real_body_state_mutation_authorized": false,
      "direct_state_adapter_present": false,
      "persistence_present": false,
      "autonomous_invocation_present": false,
      "external_update_relation": false,
      "replaceable": true,
      "body_continuity_requires_mechanism": false
    },
    {
      "mechanism_id": "RM-REALITY-CONTACT-MEMBRANE-001",
      "classification": "REPLACEABLE_NON_CONSTITUTIVE_RECIPIENT_LOCAL_OBSERVATION_MECHANISM",
      "status": "ADMITTED_ACTIVE_ON_EXPLICIT_INVOCATION",
      "admission_activation_occurrence_id": "RM-REALITY-CONTACT-MEMBRANE-ACTIVATION-OCCURRENCE-001",
      "binding": {
        "carrier": "BODY/EMBODIMENT/MECHANISMS/REALITY_CONTACT_MEMBRANE/BODY_BINDING.json",
        "sha256": "6c97789792f65a9e7a1c0b9dfc68cf3cf674ae59ef94f1d46176af7127982de6"
      },
      "implementation": {
        "carrier": "BODY/EMBODIMENT/MECHANISMS/REALITY_CONTACT_MEMBRANE/V0_1/reality_contact_membrane.py",
        "sha256": "99b770a7eda474ddfc68a189871c3907b97231d8ff5091ad11df03317552e44f"
      },
      "body_entrypoint": {
        "carrier": "BODY/EMBODIMENT/MECHANISMS/REALITY_CONTACT_MEMBRANE/V0_1/body_reality_contact_membrane.py",
        "sha256": "03cbae00dc115d38c90d0f691adf523c657b9d2cea10f56da46c618ce400844d"
      },
      "contract": {
        "carrier": "BODY/EMBODIMENT/MECHANISMS/REALITY_CONTACT_MEMBRANE/V0_1/contact_contract.json",
        "sha256": "5f5560af5010c8c173853adef005711b1d7d8b7882b9bbbbbc97a8857886d5d5"
      },
      "pressure_verifier": {
        "carrier": "BODY/EMBODIMENT/MECHANISMS/REALITY_CONTACT_MEMBRANE/V0_1/verify_reality_contact_membrane.py",
        "sha256": "a77d1d2f96497f0b6e2643fa5715b4733d667c8dc7e63499fc0d11c06a70b302",
        "activation_result": "PASS_39_OF_39"
      },
      "activation_mode": "EXPLICIT_ONE_SHOT_LOCAL_SOCKET",
      "activation_authorized": true,
      "crossing_observation_authorized": true,
      "matter_admission_authorized": false,
      "relation_or_contact_event_formation_authorized": false,
      "consequence_creation_authorized": false,
      "body_currentness_mutation_authorized": false,
      "persistent_daemon": false,
      "autonomous_invocation_present": false,
      "external_network_listener": false,
      "replaceable": true,
      "body_continuity_requires_mechanism": false,
      "operational_rebinding_occurrence_id": "RM-LOCAL-REALITY-BODY-SEMANTIC-ANATOMY-ADAPTATION-OCCURRENCE-001",
      "effect_ceiling_changed_by_rebinding": false
    }
  ],
  "surfaces": [
    {
      "surface_id": "RM-REALITY-CONTACT-MEMBRANE-LOCAL-STATE-001",
      "classification": "BODY_LOCAL_LIVING_OPERATIONAL_STATE",
      "carrier": "BODY/EMBODIMENT/LOCAL_STATE/REALITY_CONTACT_MEMBRANE_001",
      "activation_baseline_record_count": 0,
      "live_status_owner": "MECHANISM_LOCAL_JOURNAL",
      "live_record_count_owner": "MECHANISM_LOCAL_JOURNAL",
      "live_journal_tip_owner": "MECHANISM_LOCAL_JOURNAL",
      "static_projection_claims_current_live_status": false,
      "static_projection_claims_current_live_record_count": false,
      "records_created_only_on_actual_crossing": true,
      "static_manifest_coverage": false,
      "independent_hash_chain_verification_required": true,
      "semantic_owner": false
    }
  ]
}
